Name,Prices
My First Library: Boxset of 10 Board Books for Kids,INR 399.00
One Arranged Murder,INR 141.00
Think Like a Monk,INR 325.00
World’s Greatest Books For Personal Growth & Wealth (Set of 4 Books): Perfect Motivational Gift Set,INR 299.00
Ikigai: The Japanese secret to a long and happy life,INR 359.00
Attitude Is Everything: Change Your Attitude ... Change Your Life!,INR 99.00
The Alchemist,INR 175.00
Picture Books Collection for Early Learning (Set of 12),INR 225.00
Rich Dad Poor Dad : What The Rich Teach Their Kids About Money That the Poor and Middle Class Do Not!,INR 260.00
A Brief History of Modern India (2019-2020 Edition) by Spectrum Books,INR 213.00
General Knowledge 2021,INR 23.00
Indian Polity - For Civil Services and Other State Examinations | 6th Edition,INR 529.00
The Power of your Subconscious Mind,INR 90.00
Oxford Student Atlas for India - Third Edition,INR 207.00
Word Power Made Easy,INR 132.00
The Subtle Art of Not Giving a F*ck,INR 290.00
Quantitative Aptitude for Competitive Examinations,INR 502.00
Great Stories for Children,INR 123.00
The Blue Umbrella,INR 72.00
Amazon Brand - Solimo Board Books for Kids (Set of 10),INR 369.00
101 Panchatantra Stories,INR 127.00
The Monk Who Sold His Ferrari,INR 148.00
The Gopi Diaries: Coming Home,INR 104.00
"The 5 AM Club: Own Your Morning, Elevate Your Life",INR 222.00
The Theory of Everything,INR 149.00
The Psychology of Money,INR 289.00
25 Years UPSC IAS/ IPS Prelims Topic-wise Solved Papers 1 & 2 (1995-2019),INR 231.00
Very First Sight Words Sentences Level - 1,INR 119.00
The Complete Novels of Sherlock Holmes,INR 139.00
World’s Most Popular Books to Achieve Success and Build a Fortune (Set of 4 Books),INR 285.00
Wings of Fire: An Autobiography of Abdul Kalam,INR 351.00
General Knowledge,INR 161.00
505 Activities for Kids,INR 185.00
The Intelligent Investor (English) Paperback – 2013,INR 502.00
Sapiens: A Brief History of Humankind,INR 424.00
Grandma's Bag of Stories,INR 235.00
Brain Games for Clever Kids: Puzzles to Exercise Your Mind (Buster Brain Games),INR 169.00
"Writing Practice Boxset: Pack of 4 Books (Writing Fun: Write And Practice Capital Letters, Small Letters, Patterns and…",INR 189.00
1001 Activities Book,INR 240.00
The Girl in Room 105,INR 142.00
As a Man Thinketh,INR 51.00
Who Will Cry When You Die?,INR 135.00
"Lexicon for Ethics, Integrity & Aptitude for IAS General Studies - 6th Paper Edition 2020",INR 303.00
Indian Art and Culture for Civil Services and other Competitive Examinations,INR 476.00
Certificate Physical And Human Geography; Indian Edition,INR 233.00
Death; An Inside Story: A book for all those who shall die,INR 263.00
The Tower of Nero (The Trials of Apollo Book 5),INR 449.00
Peppa Pig: Little Library,INR 184.00
Legend of Suheldev: The King Who Saved India,INR 223.00
A Man Called Ove: The life-affirming bestseller that will brighten your day,INR 259.00
"My First 1000 Words: Early Learning Picture Book to learn Alphabet, Numbers, Shapes and Colours, Transport, Birds and…",INR 189.00
Atomic Habits: The life-changing million copy bestseller,INR 549.00
Harry Potter Box Set: The Complete Collection (Children’s Paperback) (Set of 7 Volumes),"INR 2,125.00"
World Map,INR 84.00
My Activity- ABC Colouring Book,INR 72.00
"Love, Hope and Magic",INR 239.00
Rich Dad Poor Dad - 20th Anniversary Edition (Hindi),INR 149.00
Inner Engineering: A Yogi’s Guide to Joy,INR 250.00
My First Library Pack 2: Boxset of 10 Board Books For Kids,INR 399.00
Deep Work: Rules for Focused Success in a Distracted World,INR 279.00
How to Win Friends and Influence People,INR 175.00
Bhagavad Gita: Yatharoop (Hindi),INR 175.00
And Then There Were None,INR 148.00
My First Book of Patterns Pencil Control: Patterns Practice book for kids (Pattern Writing),INR 125.00
Ruskin Bond - Best Selling Children Story Books Collection (Set of 4 Books),INR 440.00
Objective General English,INR 168.00
Lines and Curves (Pattern Writing) - Part 1,INR 72.00
"Indian Economy for Civil Services, Universities and Other Examinations | 12th Revised Edition",INR 297.45
The Richest Man in Babylon,INR 149.00
7 Years UPSC IAS/ IPS Mains General Studies Papers 1 - 4 Year-wise Solved (2013 - 2019),INR 146.00
The Silent Patient,INR 224.00
The Power of Your Subconscious Mind,INR 120.00
"Children's Encyclopedia - Scientists, Inventions And Discoveries: The World of Knowledge",INR 146.00
All In One - Writing Book (Practice),INR 85.00
Refreshing Mandala - Colouring Book for Adults Book 1,INR 151.00
Mandala Art: Colouring Books for Adults with Tear Out Sheets (Adult Colouring Book),INR 149.00
My First Learning Library Box Set: 20 Board Books Gift Set for Kids (Horizontal Design),INR 849.00
A Modern Approach to Verbal & Non-Verbal Reasoning (2 Colour Edition),INR 625.00
101 Animals Stories,INR 127.00
Harry Potter and the Philosopher's Stone,INR 287.00
Bharat Ki Rajvyavastha - Civil Seva Evam Anya Rajya Parikshao Hetu | 6th Edition (Hindi),INR 477.00
Objective Physics for NEET - Vol. 1 2021,INR 500.00
7 Years UPSC IAS/ IPS Mains Essay Year-wise Solved Papers (2013 - 2019),INR 61.00
Concept of Physics Part-1 (2019-2020 Session) by H.C Verma,INR 358.00
Colour with Crayons Part - 1,INR 52.00
Environment By Shankar (7th) Revised Edition (2019-2020 Session),INR 336.00
365 Colouring Book,INR 222.00
Cracking the Coding Interview (Indian Edition),INR 400.00
Bhagvad gita as it is english new edition,INR 233.00
Apke Avchetan Man Ki Shakti (The Power of your Subconscious Mind in Hindi),INR 119.00
CBSE All In One English Core Class 12 for 2021 Exam,INR 272.00
Life's Amazing Secrets: How to Find Balance and Purpose in Your Life,INR 230.00
The Official Cambridge Guide To Ielts Student's Book With Answers With Dvd Rom,INR 489.00
41 Years' Chapterwise/Topicwise Solved Papers IIT JEE Combo: Physics+Chemistry+Mathematics (Set of 3 Books),INR 689.00
Wren & Martin High School English Grammar and Composition Book (Regular Edition),INR 264.00
Challenges to Internal Security of India (Third Edition),INR 228.00
Encyclopedia: Space (Space Encyclopedia),INR 94.00
The Immortals of Meluha (Shiva Trilogy): 1,INR 208.00
Her Last Wish,INR 87.00
Space - My Knowledge Book,INR 44.00
